{
  "request_id": "req-1",
  "status": "succeeded",
  "error": "",
  "prediction": {
    "id": "p1",
    "label": "seven",
    "confidence": 0.9,
    "device_id": "",
    "runtime_model_id": "whisper-stt",
    "task": "stt",
    "timestamp": 1790242805.0,
    "scores": {},
    "source_window": null,
    "people_count": null,
    "metadata": {}
  },
  "trace": {
    "model_id": "whisper-stt",
    "execution_class": "trusted_edge"
  },
  "outputs": {
    "transcript": "seven"
  }
}
